{
  "requestVersion": "1.0.0",
  "changeSetId": "faxp-regops-20260222-0001",
  "submittedAt": "2026-02-22T00:00:00Z",
  "baseRegistryRef": "conformance/certification_registry.sample.json",
  "requestedBy": {
    "organization": "FAXP Certification Committee",
    "contactEmail": "registry-ops@faxp.org"
  },
  "approvals": {
    "policyApproved": true,
    "approverRef": "review-ticket-20260222-001"
  },
  "operations": [
    {
      "opId": "op-001",
      "action": "UPSERT",
      "adapterId": "sample-compliance-adapter-us-prod",
      "reasonCode": "EXPIRY_RENEWAL",
      "effectiveAt": "2026-02-22T00:05:00Z",
      "expectedCurrentStatus": "Active",
      "patch": {
        "certificationTier": "TrustedProduction",
        "expiresAt": "2026-12-31T00:00:00Z",
        "notes": "Promoted after production evidence review."
      }
    },
    {
      "opId": "op-002",
      "action": "REVOKE",
      "adapterId": "sample-compliance-adapter-us-prod",
      "reasonCode": "KEY_COMPROMISE",
      "effectiveAt": "2026-02-22T01:10:00Z",
      "expectedCurrentStatus": "Active",
      "notes": "Emergency revoke during signing key compromise investigation."
    },
    {
      "opId": "op-003",
      "action": "ROLLBACK",
      "adapterId": "sample-compliance-adapter-us-prod",
      "reasonCode": "ERRONEOUS_ACTION",
      "effectiveAt": "2026-02-22T02:30:00Z",
      "expectedCurrentStatus": "Revoked",
      "rollback": {
        "targetOpId": "op-002"
      },
      "notes": "Revoke rolled back after false positive and confirmed key integrity."
    }
  ],
  "requestSignature": {
    "alg": "HMAC_SHA256",
    "kid": "faxp-regops-kid-2026q1",
    "payloadDigestSha256": "sha256:44f74393ac4fc95e0ace0f616643ebbf003e5e6580efc8c168b3c681005957a5",
    "sig": "3458949fd75b7cfa527d3b26a680792080f85bc56fa085c8a702b8b7608cd412",
    "signedAt": "2026-02-22T00:00:00Z"
  },
  "auditTrailRef": "conformance/registry_update.sample.audit.log",
  "notes": "Sample registry update flow covering upsert, revoke, and rollback."
}
